passiveTaskCode	passiveTitle	passiveDescription	passiveStarRating	passiveCategory1	passiveCategory2	passiveCategory3	passivePlacementReason
6Z4W	Unlock the 'the Adventurer' title	The title is unlocked by allocating a total of 50 quest points into the Hub track at May's Quest Caravan.	1	Beginner	Easy	Medium	Based on quest points obtained after Vanquish track
3NWR	Help Pastkeeper Sharrigan to remember all stories within the Dream of Iaia	New memories have a rare chance of triggering when skilling at the skilling stations within the Dream of Iaia. Skilling at the stations require Anachronia base camp resources. This task benefits from the lorehound's Lore Helper" perk."	4	Elite	Elite	Master	Unlock in Elite task
EVXR	Obtain the Master quest cape	The cape can be obtained by completing all Master quest cape achievements.	5	-	-	Master	Forced by Master tasks
ZRXM	Assemble a Tuska mask	The five pieces of the mask will be obtained during Airut slayer tasks.	4	Hard	Elite	Master	Assembly based on item drops in latest possible tier
V44R	Unlock the 'of the Ithell' title	Craft 100 Crystal flasks.	3	-	-	Elite	Crafting requirement
75NB	Unlock the 'of the Meilyr' title	Harvest 50 Harmony Moss from the Harmony Pillars in the Meilyr district.	3	-	Hard	Elite	Pillar RNG
6ZN3	Obtain the Completionist cape	The cape can be obtained by completing all Completionist achievements.	4	-	-	Master	Forced by Master tasks
55BG	Obtain Zez, the Runescore pet	Zez is unlocked upon reaching 5k total Runescore.	1	-	-	Medium	Forced by task progression
357B	Upgrade Zez for the first time	Zez upgrades for the first time upon reaching 10k total Runescore.	2	-	-	Hard	Forced by task progression
GQ25	Upgrade Zez for the second time	Zez upgrades for the second time upon reaching 15k total Runescore.	3	-	-	Elite	Forced by task progression
7KZX	Upgrade Zez for the third time	Zez upgrades for the third time upon reaching 20k total Runescore.	4	-	-	Elite	Forced by task progression
KV26	Upgrade Zez for the fourth time	Zez upgrades for the fourth time upon reaching 25k total Runescore.	5	-	-	Master	Forced by task progression
GZJ2	Upgrade Zez for the fifth time	Zez upgrades for the fifth time upon reaching 30k total Runescore.	5	-	-	God	Forced by task progression
QJR6	Obtain the Completionist cape (t)	The cape can be obtained by completing all Trimmed completionist cape achievements.	5	-	-	God	Forced by mode completion
M6E7	Complete a lap of the Anachronia agility course in less than seven minutes	Going counter-clockwise and using Surge and Bladed dive with the Mobile perk strategically, increases your speed significantly.	3	-	-	Elite	Agility requirement
9X2R	Tour d'Anachronia, clock- and counter-clockwise	Complete the entire Anachronia course in both directions.	3	-	-	Elite	Agility requirement
98RK	Train on a Serenity post 25 times	Train on serenity posts for the daily cap, which is 20,000 Agility experience, 25 times.	4	Hard	Elite	Master	Prif unlock required
X9QJ	Have three active relic powers at the same time	After offering relics to the mysterious monolith, you can activate up to three powers at once, at a cost of chronotes and monolith energy.	2	-	Beginner	Easy	3 powers guaranteed in Easy
GWDQ	Attempt to attach an Armadyl Hilt to a damaged Prototype Godsword	Prototype Godsword can be obtained from completing the Armadylean special research. A Stormguard Gerege must be added to your toolbelt to complete this task. An Archaeology level of 95 is required.	3	Hard	-	Elite	Assembly based on item drops in latest possible tier
BV3M	Finish researching the Archaeology Guild	Complete all special research missions relating to the Archaeology Guild. This requires an Archaeology level of 99.	3	-	Elite	Master	Archaeology requirement
M933	Finish researching the Senntisten digsite	Complete all special research missions relating to Senntisten. This requires an Archaeology level of 67.	3	-	Medium	Hard	Archaeology requirement
ZXQJ	Finish researching the Infernal Source digsite	Complete all special research missions relating to the Infernal Source. This requires an Archaeology level of 98.	3	-	Elite	Master	Archaeology requirement
9XNJ	Finish researching the Everlight digsite	Complete all special research missions relating to Everlight. This requires an Archaeology level of 105.	4	-	Elite	Master	Archaeology requirement
ENE3	Finish researching the Kharid-et digsite	Complete all special research missions relating to Kharid-et. This requires an Archaeology level of 107.	4	-	-	Master	Archaeology requirement
X9QZ	Finish researching the Stormguard Citadel digsite	Complete all special research missions relating to the Stormguard Citadel. This requires an Archaeology level of 118.	5	-	-	Master	Archaeology requirement
N43V	Finish researching the Warforge! digsite	Complete all special research missions relating to the Warforge!. This requires an Archaeology level of 119.	5	-	-	Master	Archaeology requirement
JB36	Finish researching the Orthen digsite	Complete all special research missions relating to Orthen. This requires an Archaeology level of 120.	5	-	Master	Legendary	Archaeology requirement
4B98	Send 5 of your consultants off to research together	Consultants are recruited to your research team when you solve all mysteries at their respective digsites. Completion of this task will require an Archaeology level of 110.	5	-	-	Master	Archaeology requirement - 5 consultants available in Master
4Q92	Complete a total of 200 collections	Completing any collection, done by handing it in in its entirety, counts, including the same collection many times over.	5	-	-	Elite	Collections required for various tasks
NX5X	Have your researchers go at it for 1440 hours	Research is unlocked by reaching the assistant qualification. From that point, you are allowed to conduct research whenever you have spare chronotes.	3	Elite	-	Master	Timegated + chronotes locked
JM5D	Excavate a total of 2500 artefacts	All artefacts excavated by you count.	5	-	-	Master	Excavations required for tasks
R8KV	Restore a total of 2500 artefacts	All artefacts restored by you count.	5	-	Master	Legendary	Restoration not enforced by tasks
YVN4	Excavate at Kharid-Et while the Pylons are active	An Archaeology level of 12 is required. Once the pylons have been charged to 100% there is a 30 minute time-span in which excavating at the Kharid-Et site has additional buffs.	1	Beginner	-	Easy	Timegated
3K6W	Restore the Inquisitor Staff to its former glory	The inquisitor staff requires you to find three incredibly rare pieces while excavating at Kharid-et, then assemble them (along with a praetorian staff) with a Runecrafting level of 93.	5	-	Master	Legendary	Assembly based on item drops in latest possible tier
RXWB	Do a pretty crappy job on a construction contract	Earn a single credit from completing a construction contract. Use only basic materials.	2	-	-	Easy	First construction contract task
Y2W3	Do a freakin' excellent job on a construction contract!	Earn 5 credits from a construction contract. Use only mahogany planks.	3	-	Medium	Hard	First construction contract task + construction level
JDYQ	Complete a total of 100 construction contracts	Complete a total of 100 contracts given to you by the estate agents. I suggest looking into upgrading your own house after this, it deserves some attention.	4	-	Hard	Elite	Forced by task requirements
85JK	Talk to the Drunken Dwarf while carrying 28 different Ales	A Cooking level of 64 is required. Most of the mature versions can only be obtained through brewing.	5	Hard	Elite	Master	Timegated + The Stuff drops
MMRD	Taste ALL the fishy dishes	A Cooking level of 99, a Fishing level of 68 and the completion of the quest Heroes' Quest are required.	5	-	-	Master	Cooking level + Ports soup recipe
MG6V	Check out the School of Jewels	A Crafting level of 79 is required.	5	Hard	-	Elite	Crafting level + Reaper requirement
8KGZ	Create all alchemical jewellery	The brooch can be created by enchanting an alchemical hydrix brooch. A Crafting level of 97 is required.	5	-	-	Master	Crafting level + Reaper requirement
D25B	Claim 25 rewards from the Motherlode Maw in the Edimmu resource dungeon	A Dungeoneering level of 115 is required. The Motherlode Maw can be looted once a day.	5	Master	-	Legendary	Dungeoneering requirement + timegate
WV4J	Complete the Rabbit breeding log	Completing the log requires all variants of the species to be bred, shinies included.	3	Beginner	-	Easy	Timegated
5Q43	Complete the Chicken breeding log	Completing the log requires all variants of the species to be bred, shinies included.	3	Beginner	-	Easy	Timegated
3QZX	Complete the Sheep breeding log	Completing the log requires all variants of the species to be bred, shinies included.	3	Easy	-	Medium	Timegated
G75R	Complete the Frog breeding log	Completing the log requires all variants of the species to be bred, shinies included.	4	Easy	-	Medium	Timegated
78XR	Complete the Cow breeding log	Completing the log requires all variants of the species to be bred, shinies included.	4	Easy	Medium	Hard	Timegated
B2GN	Complete the Chinchompa breeding log	Completing the log requires all variants of the species to be bred, shinies included.	4	Medium	Hard	Master	Timegated
M4YE	Complete the Spider breeding log	Completing the log requires all variants of the species to be bred, shinies included.	4	Medium	-	Hard	Timegated
Z25B	Complete the Yak breeding log	Completing the log requires all variants of the species to be bred, shinies included.	4	Medium	-	Hard	Timegated
98JK	Complete the Jadinko breeding log	Completing the log requires all variants of the species to be bred, shinies included.	4	Medium	Hard	Elite	Timegated
4QZ2	Complete the Zygomite breeding log	Completing the log requires all variants of the species to be bred, shinies included.	4	Medium	Hard	Elite	Timegated
XV52	Complete the Dragon breeding log	Completing the log requires all variants of the species to be bred, shinies included.	5	Hard	Elite	Master	Timegated
JMND	Complete the Varanusaur breeding log	Completing the log requires all variants of the species to be bred, shinies included.	5	-	Elite	Master	Timegated + Breedable dinosaur pair tasks
R86V	Complete the Arcane apoterrasaur breeding log	Completing the log requires all variants of the species to be bred, shinies included.	5	-	Elite	Master	Timegated + Breedable dinosaur pair tasks
YV54	Complete the Brutish dinosaur breeding log	Completing the log requires all variants of the species to be bred, shinies included.	5	-	Elite	Master	Timegated + Breedable dinosaur pair tasks
85NK	Complete the Salamander breeding log	Completing the log requires all variants of the species to be bred, shinies included.	5	-	-	Elite	Timegated
VV58	Complete the Scimitops breeding log	Completing the log requires all variants of the species to be bred, shinies included.	5	-	Elite	Master	Timegated + Breedable dinosaur pair tasks
2QB6	Complete the Bagrada rex breeding log	Completing the log requires all variants of the species to be bred, shinies included.	5	-	Master	Legendary	Timegated + Breedable dinosaur pair tasks
E2MG	Complete the Spicati apoterrasaur breeding log	Completing the log requires all variants of the species to be bred, shinies included.	5	-	Master	Legendary	Timegated + Breedable dinosaur pair tasks
6Q49	Complete the Asciatops breeding log	Completing the log requires all variants of the species to be bred, shinies included.	5	-	Master	Legendary	Timegated + Breedable dinosaur pair tasks
Q8E7	Complete the Corbicula rex breeding log	Completing the log requires all variants of the species to be bred, shinies included.	5	-	Master	Legendary	Timegated + Breedable dinosaur pair tasks
D2BB	Complete the Oculi apoterrasaur breeding log	Completing the log requires all variants of the species to be bred, shinies included.	5	-	Master	Legendary	Timegated + Breedable dinosaur pair tasks
WVGJ	Complete the Malletops breeding log	Completing the log requires all variants of the species to be bred, shinies included.	5	Master	Legendary	God	Timegated + Breedable dinosaur pair tasks
5Q93	Complete the Pavosaurus rex breeding log	Completing the log requires all variants of the species to be bred, shinies included.	5	Master	Legendary	God	Timegated + Breedable dinosaur pair tasks
QJE9	Unlock the 'Old Mc' title	The title is unlocked by talking to Sam or Stan the sheepdog at Manor Farm or the Ranch Out of Time respectively, after fully completing the breeding log.	5	-	Legendary	God	Timegated + Breedable dinosaur pair tasks
3QMX	Successfully breed all Manor Farm animals with the Ravensworn trait	After obtaining the 'the Ravensworn' title, your animals can start breeding with this trait. It only appears in slots 2 or 3.	5	Hard	Elite	Master	Timegated + Ravensworn title
G79R	Obtain the Apprentice Farmer rank	Requires 4,000 reputation. Reputation is gained when carrying out most activities granting Farming experience.	1	-	-	Easy	Timegated
78ER	Obtain the Practiced Farmer rank	Requires 10,000 reputation. Reputation is gained when carrying out most activities granting Farming experience.	2	-	Easy	Medium	Timegated
KZ6X	Obtain the Competent Farmer rank	Requires 25,000 reputation. Reputation is gained when carrying out most activities granting Farming experience.	2	Easy	-	Medium	Timegated
B2XN	Obtain the Expert Farmer rank	Requires 75,000 reputation. Reputation is gained when carrying out most activities granting Farming experience.	3	-	Medium	Hard	Timegated
M4DE	Obtain the Master Farmer rank	Requires 225,000 reputation. Reputation is gained when carrying out most activities granting Farming experience.	3	Medium	-	Hard	Timegated
Z28B	Obtain the Senior Master Farmer rank	Requires 1,100,000 reputation. Reputation is gained when carrying out most activities granting Farming experience.	4	Hard	-	Elite	Timegated
98QK	Obtain the Grandmaster Farmer rank	Requires the maximum 2,500,000 reputation. Reputation is gained when carrying out most activities granting Farming experience.	5	Elite	-	Master	Timegated
4Q82	Upgrade your Seedicide	Bought from the Farmers' Market for 25,000 beans.	3	-	-	Hard	Timegated + Beans
XVR2	Upgrade your Herbicide	Bought from the Farmers' Market for 25,000 beans.	3	Medium	-	Hard	Timegated + Beans
NX7X	Obtain the Left banana of knowledge	Can be obtained as a reward from Ifaba's farming requests.	3	Beginner	-	God	RNG
JMED	Obtain the Right banana of knowledge	Can be obtained as a reward from Ifaba's farming requests.	3	Beginner	-	God	RNG
R8ZV	Unlock the breeding perk for small animal pens	Bought from Granny Potterington at the Player-owned Farm for 1,000 beans.	1	Beginner	-	Easy	Timegated + Beans
YVY4	Unlock the breeding perk for medium animal pens	Bought from Granny Potterington at the Player-owned Farm for 3,000 beans.	2	Easy	-	Medium	Timegated + Beans
856K	Unlock the breeding perk for large animal pens	Bought from Granny Potterington at the Player-owned Farm for 7,000 beans.	3	Medium	-	Hard	Timegated + Beans
VVN8	Unlock the Seasonaliser wheel	Bought from Granny Potterington at the Player-owned Farm for 5,000 beans.	3	-	-	Medium	Timegated + Beans
2QR6	Unlock the Noted produce perk	Bought from Granny Potterington at the Player-owned Farm for 3,000 beans.	3	Easy	-	Medium	Timegated + Beans
E2RG	Unlock all three Multiple trait boosts	Bought from Granny Potterington at the Player-owned Farm for 6,000 (small), 9,000 (medium) and 12,000 (Large) beans for a total of 27,000.	5	Medium	-	Hard	Timegated + Beans
6Q29	Unlock the Player-owned Farm status icons	Bought from Granny Potterington at the Player-owned Farm for 1,500 beans. Talk to Granny Potterington to toggle this unlock on and off.	2	Easy	-	Medium	Timegated + Beans
Q8M7	Unlock the Farm deeds	Bought from Granny Potterington at the Player-owned Farm for 250,000 beans.	5	-	-	Elite	Timegated + Beans
D2JB	Unlock the Storm Barn and its extensions	Bought from Granny Potterington at the Player-owned Farm for 5,000 (barn deeds), 20,000 (extension 1) and 60,000 (extension 2) beans for a total of 85,000.	5	Medium	-	Hard	Timegated + Beans
5M45	Unlock access to your Storm Barn from Anachronia	Bought from Prehistoric Potterington at the Ranch Out of Time for 7,500 beans.	4	Medium	Hard	Elite	Timegated + Beans
WVJJ	Unlock Trevor the magical Zygomite	Bought from Granny Potterington at the Player-owned Farm for 10,000 beans. Can only be bought after completing the achievement 'Ever So Clever'.	5	Hard	Elite	Master	Timegated + Beans
5QV3	Recruit Thing for your Player-owned Farm	Bought from Granny Potterington at the Player-owned Farm for 1,000 beans. Farmhands will stop animals from growing past the adolescent stage at the cost of beans.	2	Beginner	-	Easy	Timegated + Beans
3QYX	Recruit Handy for your Player-owned Farm	Bought from Granny Potterington at the Player-owned Farm for 1,000 beans. Farmhands will stop animals from growing past the adolescent stage at the cost of beans.	2	Beginner	-	Easy	Timegated + Beans
G78R	Recruit Zygomaid for your Player-owned Farm	Bought from Granny Potterington at the Player-owned Farm for 2,000 beans. Farmhands will stop animals from growing past the adolescent stage at the cost of beans.	2	Beginner	-	Easy	Timegated + Beans
783R	Recruit Emile for your Player-owned Farm	Bought from Granny Potterington at the Player-owned Farm for 2,000 beans. Farmhands will stop animals from growing past the adolescent stage at the cost of beans.	2	Easy	-	Medium	Timegated + Beans
KZYX	Recruit Dorbo for your Player-owned Farm	Bought from Granny Potterington at the Player-owned Farm for 3,500 beans. Farmhands will stop animals from growing past the adolescent stage at the cost of beans.	2	Easy	-	Medium	Timegated + Beans
B2BN	Recruit Teensy for your Player-owned Farm	Bought from Granny Potterington at the Player-owned Farm for 3,500 beans. Farmhands will stop animals from growing past the adolescent stage at the cost of beans.	2	Easy	-	Medium	Timegated + Beans
M4VE	Recruit Karen for your Player-owned Farm	Bought from Granny Potterington at the Player-owned Farm for 3,500 beans. Farmhands will stop animals from growing past the adolescent stage at the cost of beans.	2	Easy	-	Medium	Timegated + Beans
Z24B	Recruit Susan for your Player-owned Farm	Bought from Granny Potterington at the Player-owned Farm for 3,500 beans. Farmhands will stop animals from growing past the adolescent stage at the cost of beans.	2	Easy	-	Medium	Timegated + Beans
983K	Recruit Callia for your Player-owned Farm	Bought from Granny Potterington at the Player-owned Farm for 2,500 beans. Farmhands will stop animals from growing past the adolescent stage at the cost of beans.	2	Easy	Medium	Hard	Timegated + Beans
4Q32	Recruit Adam Antite for your Player-owned Farm	Bought from Granny Potterington at the Player-owned Farm for 5,000 beans. Adam can be sent out to retrieve unchecked animals every 6 hours for 100 beans.	3	Easy	-	Medium	Timegated + Beans
XVZ2	Construct the Breeding pen on the Ranch Out of Time	Bought from Prehistoric Potterington at the Ranch Out of Time for 1,000 beans. Requires 42 Farming to buy the pen deed and 55 Construction alongside 100,000 wood, vines and stone from the Anachronia base camp to build the pen.	2	-	-	Medium	Timegated + Beans
7838	Unlock the breeding perk for small dinosaur pens	Bought from Prehistoric Potterington at the Ranch Out of Time for 6,000 beans.	3	-	-	Hard	Timegated + Beans
KZY7	Unlock the breeding perk for medium dinosaur pens	Bought from Prehistoric Potterington at the Ranch Out of Time for 8,000 beans.	4	-	-	Elite	Timegated + Beans
B2BQ	Unlock the breeding perk for large dinosaur pens	Bought from Prehistoric Potterington at the Ranch Out of Time for 10,000 beans.	5	-	-	Elite	Timegated + Beans
M4V9	Purchase the Max Guild portal-redirection to the Ranch out of Time	Bought from Prehistoric Potterington at the Ranch Out of Time for 5,000 beans.	3	-	-	Hard	Timegated + Beans
Z24Y	Set foot in the world of the beanionnaires	Obtain a grand total of 1,000,000 Beans.	5	Elite	-	Master	Timegated + Beans
983E	Speak to Pickle the cat on the Manor farm when her mice kill count is in double digits	Requires an amulet of catspeak.	1	-	-	Easy	Catspeak amulet obtained in Easy
4Q3G	Breed an Evil chicken	When a male and a female chicken spend a lot of time together, and they really like each other, the cock might decide to do something evil.	3	Easy	-	Medium	Timegated
XVZW	Show Malcolm to Granny	Animal trait re-rollers can be used to get the chaotic trait on your a Lizard Chicken hen, then name re-rollers to change their name to Malcolm. Do it in this order, the other way around does not work.	3	Easy	Medium	Hard	Timegated
JMR5	Fill both small pens with rabbits	Requires 12 rabbits total and both small pens bought.	3	-	-	Easy	Short timegate
R8D6	Fill a medium pen with one of each of the four seasonal rams	The four seasonal rams can only be breed during it's specific season. The seasonliser from the Farmers' Market can be used to change the season at the farm.	3	Easy	-	Medium	Short timegate + RNG
YV9Y	Make a Player-owned farm Chinchompa explode	Chinchompas with the Unstable trait have a chance to explode when they are harvested for experience.	3	Easy	Medium	Hard	Short timegate + RNG
8533	Have 6 tier II animal perks active simultaneously at your farm	Requires 6 farm totems from the Farmers' Market. Need all small, medium and large pens to have the same mating pairs in every pen. The animals have to be elder.	2	-	Easy	Medium	Timegated
VVB7	Have 9 tier I animal perks active simultaneously at your farm	Requires 6 farm totems from the Farmers' Market. One small pen needs to have a hen and a rooster, the other a chinchompa or rabbit. One medium pen needs to have a ram and an ewe, the other a spider or zygomite. One large pen needs to have a bull and a cow, the other a yak or dragon. All the animals have to be elder.	3	-	Medium	Hard	Timegated
6VD7	Cure 100 animals on your farm	Cure 100 diseased animals of their curses, coughs, chews and coronas	2	-	Easy	Medium	Timegate + RNG or forced neglect
M934	Force-feed a broad selection of Honeycombs to any animal on your Player-owned Farm	Some of the Honeycombs are made from Flowers obtained in Het's Oasis.	3	-	-	Hard	Farming level
2Q38	Become the Ruler of the Sea	This is achieved by succesfully completing all Deep Sea Fishing encounters, these being the whale, the jellyfish invasion and the seamonster.	3	Hard	Elite	Master	Fishing level + Event RNG
E2ZW	Check out what's up for sail at the Deep Sea Fishing Merchant and make a purchase	The mechant spawns randomly at the hub and stays for a few minutes before departing. Spawns are unique to worlds, so hopping to find him is an option.	2	-	-	Medium	Fishing level
6QRG	Interact with the Sea turtle at the Deep Sea Fishing Hub	The turtle is extremely rare to come upon. Good luck. Claiming the loot from it is allowed.	4	-	Medium	Hard	Fishing level + Event RNG
Q86R	Deposit 100 buckets of sand in the Whirlpool spawning randomly at the Deep Sea Fishing Hub	Be quick(sand) about it - the whirlpool doesn't stay for long!	3	-	Medium	Hard	Fishing level + Event RNG
D2MR	Grow most of the existing herbs	Check the link for a comprehensive list.	4	-	-	Hard	Farming level + drop requirements
MEJ3	Create and fill a Blessed flask	Crafting the flask requires an Herblore and Crafting level of 118 and 96, respectively, and a huge amount of supplies ranging from stone spirits to positive energies.	5	Master	Master	Legendary	Herblore level + crafting level + timegated
8G2Q	Obtain a full set of Witchdoctor equipment	The top or legs are obtained from Papa Mambo by catching all non-God Jadinkos within 1 week, requiring a Hunter level of 81. Additionally catching the three God Jadinkos requires a Hunter level of 81 and will reward you with the mask. The ten normal Jadinkos can be caught on Anachronia as well as in the Herblore Habitat hunter area, while the God set are only found on Karamja.	3	-	-	Elite	Hunter level + Timegated
6VZN	Mine a Diamond in the Trahaearn district of Prifddinas	Can only be completed while the Voice of Seren is active in the Trahaearn district.	3	-	-	Hard	Prif unlock required
XN5G	Mine Light animica rocks in the Trahaearn district of Prifddinas	The ore rocks may not spawn on every world, hopping may be needed when the Voice becomes active.	4	-	-	Elite	Prif unlock required + Mining level requirement
VX6N	Mine one of each ore and regular rock	Mine one of each of the listed ores: copper, tin, iron, coal, silver, mithril, adamantite, luminite, gold, runite, orichalcite, drakolith, necrite, phasmatite, banite, light & dark animica, clay, granite, limestone, rune essence, any gem rock, sandstone (from the Desert Quarry, not from Menaphos).	3	-	-	Elite	Mining level
84KJ	Gain all experience possible from The Nexus	A total of 50,339 prayer xp can be gained.	1	Easy	Medium	Hard	Group requirement
WVKE	Hand in Rune dust to a Runesphere 25 times	The dust can be banked and any amount can be handed in to progress the achievement. Dust can only be handed in once per day.	5	Beginner	Elite	Master	Unlock + timegated
BV5M	Entirely fill up your Personal Slayer dungeon	You will need a total of 15 monster souls (of which 5 must be classified as small monsters) in order to fill the chambers of your dungeon. The choice of souls is up to you, as long as you stick to the rules when hunting them!	5	Elite	Elite	Master	Requires third PokÃ©dex task
5QJB	Tune a Bane sword into either its Revenant, Dragon or Abyssal bane variant	This is accomplished by combining a bane (2h) sword +4 with draconic visages (dragon bane), abyssal whips (abyssal bane), or corrupted variants of the Statius or Vesta weapons (revenant bane). The 2h sword requires two identical items.	4	Hard	-	Elite	Smithing requirement
