passiveTaskCode	passiveTitle	passiveDescription	passiveStarRating	passiveCategory1	passiveCategory2	passiveCategory3	passivePlacementReason
7GK6	Create all enhanced boots	A Shadow spike, which can be obtained from Raksha, the Shadow Colossus, can be infused with the laceration boots to upgrade them to t90 melee power boots.	5	Master	-	Legendary	Requires repeat drops of shadow spikes
7KMX	Create an Eldritch crossbow	The crossbow is assembled out of its three pieces, the stock, the limbs, and the mechanism, this requires a Fletching level of 96.	5	Legendary	-	God	Assembly based on item drops in latest possible tier
JXGY	Create a set of Tectonic armour	Creating the set requires 84 Tectonic energy, 6 Stones of binding and a Runecrafting level of 93.	5	-	-	Master	Runecrafting level and low amount of ED drops
RM53	Create a set of Sirenic armour	Creating the set requires 84 Sirenic scales, 6 Algarum thread and a Crafting level of 93.	5	-	-	Master	Crafting level and low amount of ED drops
YR3N	Create a set of Malevolent armour	Creating the set requires 84 Malevolent energy, 6 Reinforcing plates and a Smithing level of 93.	5	-	-	Master	Smithing level and low amount of ED drops
BYV4	Create a set of elite tectonic armour	It is made by using 140 Draconic energy, a tectonic mask, 1 Stone of binding and 2 Praesulic essence (magic). A Runecrafting level of 99 is required to break Virtus items down into Praesulic essence (magic).	5	Master	Legendary	God	Assembly based on item drops in latest possible tier
7GK7	Create a set of elite sirenic armour	It is made by using 140 Ancient scales, a sirenic mask, 1 Algarum thread and 2 praesulic essence (ranged). A Crafting level of 99 is required to break Pernix items down into Praesulic essence (ranged).	5	Master	Legendary	God	Assembly based on item drops in latest possible tier
XJDB	Create a set of trimmed Masterwork armour	It is made by using a Masterwork helm with 2 masterwork trim. To trim a piece of Masterwork equipment, you need Praesulic essences (melee) and Malevolent essences.	5	Master	Legendary	God	Assembly based on item drops in latest possible tier
5MYX	Create a set of custom-fit spiked trimmed Masterwork armour	Once you have the full set of trimmed Masterwork armour, you can talk to Elof to custom-fit it. You can then visually customize this further by bringing Elof a Glorious bar for each piece of the set, making it 5 glorious bars in total.	5	-	Legendary	God	Assembly based on item drops in latest possible tier
3N5N	Create all Rune Dragon boots	These boots can be created by using 2 steadfast scales together with the steadfast boots. They are T90 melee power boots.	4	Hard	-	Master	Assembly based on item drops in latest possible tier
ZRQG	Create the Terrasaur maul	The maul is assemblied from 3 components. Each component can be obtained from a tier 3 dinosaur through big game hunter.	5	-	-	Master	Assembly based on item drops in latest possible tier
VGD9	Obtain Perdita	Perdita is unlocked by speaking to Merethiel after killing Solak a total of 1,000 times. Good luck!	5	Elite	Legendary	God	Assembly based on item drops in latest possible tier
NXWR	Obtain the Mortar Board	Unlocked upon gaining the 50th training point in Boss assistance. Points are awarded if you have more than 10 kills in the boss, and other team members have less than 10.	4	Elite	Master	Legendary	Dependant on learners
JMY8	Unlock the 'the Master' title	Unlocked upon gaining the 250th training point in Boss assistance. Points are awarded if you have more than 10 kills in the boss, and other team members have less than 10.	4	Master	Legendary	God	Dependant on learners
R8W2	Unlock Cornellius	Unlocked upon gaining the 500th training point in Boss assistance. Points are awarded if you have more than 10 kills in the boss, and other team members have less than 10.	5	Master	Legendary	God	Dependant on learners
VG7R	Assemble Laniakea's spear	The four pieces of the spear are dropped by the Rex Matriarchs. The spear can be re-assembled by Laniakea if you bring her the pieces.	4	Hard	Elite	Master	Assembly based on item drops in latest possible tier
QBV8	Create all Rex Matriarch rings	The Stalker's ring is a ring obtained by combining the Heart of the Archer with 10 Archers' rings.	4	Hard	-	Master	Assembly based on item drops in latest possible tier
GZQG	Create all enhanced gloves	The Enhanced Nightmare guantlets are made by combining 1,000 Glacor remnants, 1 Leng Artefact and 1 pair of Nightmare gauntlets.	5	Elite	-	Legendary	Assembly based on item drops in latest possible tier
9X57	Create an Upgraded bone blowpipe	Combining the bone blowpipe with the feather, chitin and fins required both 87 Crafting and Fletching and results in the upgraded bone blowpipe.	5	Master	Legendary	God	Assembly based on item drops in latest possible tier
VM49	Create an Abyssal vine whip	Combine an abyssal whip with a whip vine.	3	-	-	Hard	Assembly based on item drops in latest possible tier
VM24	Create the dragon platebody	The dragon platebody can be created by combining the 3 armour pieces which are dropped by Tormented Demons.	4	-	Master	Legendary	Assembly based on item drops in latest possible tier
7JQ9	Obtain the Masterwork Spear of Annihilation	An Archaeology level 115 and a Smithing level of 99 are required to restore and repair the Spear to it's former glory.	5	Master	Legendary	God	Assembly based on item drops in latest possible tier
9BX9	Create all vital spark codices	The codice can by combining a total of 2,000 Vital sparks.	5	Master	-	Legendary	High vital spark requirement
5R5M	Create a set of elite ranger armour	Combine a Robin Hood hat with a Golden thread.	4	Master	-	Legendary	Clue RNG
W3E3	Assemble the Mizuyari	Seiryu's Fang can be purchased at a cost of 5,000 Chimes when owning Seiryu's claw. The claw is a rare drop from Arhats, requiring a Slayer level of 96 to harm. They can be found in the Well of Spirits, which requires completion of the Spiritual Enlightenment miniquest. It also is a rare drop from the Temple of Aminishi when using Lucky charms.	3	-	Elite	Master	Assembly based on item drops in latest possible tier
79GZ	Overcharge your Pontifex shadow ring	You can overcharge your ring by adding 5,000 of each anima type after fully upgrading it.	4	Hard	Elite	Master	High kill requirement
4BBY	Craft Pernix's Quiver	If you have the top tier Pontifex Ring, youâ€™ll start to find Quiver Fragments in tier 3 Elder Troves. You need 100 Fragments to make the quiver.	3	-	Elite	Master	High kill requirement for troves
N44N	Upgrade your TokHaar-Kal-Ket to the Igneous Kal-Ket	The TokHaar-Kal-cape is upgraded by infusing it with an Igneous stone obtained by defeating TzKal-Zuk without using checkpoints.	3	-	-	Master	Assembly based on item drops in latest possible tier
JBBK	Upgrade your TokHaar-Kal-Xil to the Igneous Kal-Xil	The TokHaar-Kal-cape is upgraded by infusing it with an Igneous stone obtained by defeating TzKal-Zuk without using checkpoints.	3	-	-	Master	Assembly based on item drops in latest possible tier
RGG4	Upgrade your TokHaar-Kal-Mej to the Igneous Kal-Mej	The TokHaar-Kal-cape is upgraded by infusing it with an Igneous stone obtained by defeating TzKal-Zuk without using checkpoints.	3	-	-	Master	Assembly based on item drops in latest possible tier
4EJ6	Combine your Igneous Kal-capes into the Igneous Kal-Zuk	The ability to create the Igneous Kal-Zuk requires a flawless defeat of TzKal-Zuk in hard mode. It furthermore requires each of the Igneous Kal-capes.	4	-	Master	Legendary	Assembly based on item drops in latest possible tier
844V	Create the Ek-ZekKil	The sword is obtained by combining an Obsidian blade, a Magma core, and an Ancient hilt, all of which can be obtained after defeating TzKal-Zuk in Hard Mode.	5	-	Master	Legendary	Assembly based on item drops in latest possible tier
4JBK	Create all limitless staves	The staff is created by attaching an Elemental impetus to a Mystic staff. This requires a Crafting level of 75.	4	Elite	Legendary	God	Clue RNG
DKQD	Create a set of Cryptbloom armour	The incomplete helm dropped by Croesus can be combined with 1,000 Croesus flakes, requiring a Crafting level of 90.	5	-	-	Master	Crafting level + Assembly based on item drops in latest possible tier
N4KZ	Assemble the fractured staff of Armadyl	The staff is assembled from three pieces, all of which are dropped by Hard Mode Kerapac. This also requires a Crafting level of 95.	5	-	Master	Legendary	Assembly based on item drops in latest possible tier
Y456	Assemble a Dragon square shield	The Dragon square shield is assembled from a Shield left half, a rare item obtain through the rare drop table, and a Shield right half, which can be bought for 750,000 GP from Siegfried Erkle underneat the Legend's Guild. Assembling the shield requires a Smithing level of 60 and can be done at an anvil.	3	Medium	Hard	Elite	Assembly based on item drops in latest possible tier
MR96	Create all enhanced glove and Matriarch ring Enchantments	Requires an Invention level of 80 to be assembled from 8 Slivers of strength, 6 Shadow components and an Abyssal vine whip.	5	Hard	Elite	Master	Invention requirement + Assembly based on item drops in latest possible tier
NXZR	Obtain the Gud raider chainbody	The body is obtained as a very rare drop from Goblin raids. The raids happen twice an hour.	3	Beginner	Elite	Master	Timegated + RNG
JM78	Obtain the Gud raider shield	The shield is obtained as a very rare drop from Goblin raids. The raids happen twice an hour.	3	Beginner	Elite	Legendary	Timegated + RNG
R8N2	Obtain the Gud raider axe	The axe is obtained as a very rare drop from Goblin raids. The raids happen twice an hour.	3	Beginner	Master	Legendary	Timegated + RNG
YVG7	Obtain the Mimic plushie	Obtained as a very rare drop from the hard and elite versions of the Giant Mimic.	5	Master	Legendary	God	Mimic Token + RNG
85E9	Obtain the Mimic helm	Obtained as a very rare drop from the hard and elite versions of the Giant Mimic.	5	-	Legendary	God	Mimic Token + RNG
VV83	Obtain the Mimic pet	Obtained as a very rare drop from any version of the Giant Mimic.	5	-	Legendary	God	Mimic Token + RNG
2QE2	Obtain the Mimic tongue cape	Obtained as a very rare drop from the hard and elite versions of the Giant Mimic.	5	-	Legendary	God	Mimic Token + RNG
3Q6E	Obtain the Shard of Malice weapon token	Obtained as a rare drop from the hard and elite versions of the Giant Mimic.	5	Hard	Elite	Master	Mimic Token + RNG
G7EE	Obtain the Shard of Suffering weapon token	Obtained as a rare drop from the hard and elite versions of the Giant Mimic.	5	Hard	Elite	Master	Mimic Token + RNG
786D	Obtain the Shard of Havoc weapon token	Obtained as a rare drop from the hard and elite versions of the Giant Mimic.	5	Hard	Master	Legendary	Mimic Token + RNG
KZE3	Obtain the Shard of Energy weapon token	Obtained as a rare drop from the hard and elite versions of the Giant Mimic.	5	Hard	Master	Legendary	Mimic Token + RNG
B2E5	Obtain the Shard of Chaos weapon token	Obtained as a rare drop from the hard and elite versions of the Giant Mimic.	5	Hard	Master	Legendary	Mimic Token + RNG
M4GY	Obtain the Shard of Despite weapon token	Obtained as a rare drop from the hard and elite versions of the Giant Mimic.	5	Hard	Legendary	God	Mimic Token + RNG
YRDJ	Create all hydrix jewellery	The ring can be created by enchanting a hydrix ring. A Crafting level of 79 is required.	5	Hard	Elite	Master	Crafting level + Reaper requirement
Z2V8	Imbue and overcharge a Ring of Death	The ring can be created by enchanting a hydrix ring. It can then be imbued for a cost of 15,000 Teci at the Armoursmith on Mazcab. It can also be overcharged by buying the unlock for 150 Reaper points and then combining it with 5 cut onyxes and 25 black stone hearts by handing those in to Death. A Crafting level of 79 is required.	4	Elite	Master	Legendary	Crafting level + Reaper requirement + Raids
YVW7	Create the Book of Death	The ability to craft the book can be unlocked for 500 Reaper points. A cut hydrix and 4 Death notes, costing 40 Reaper points each, are used to make the book. A Crafting level of 80 is required.	5	Hard	Elite	Master	Crafting level + Reaper requirement
85D9	Unlock the Reaper's choice perk	Unlocked in the Reaper store for 250 Reaper Points. It gives you a 10% chance of being able to choose your assignment when receiving a new one. Rerolled assignments also have this chance.	3	Medium	Hard	Elite	Reaper Requirement
3J8M	Unlock the ability to buy further reaper assignments with Slayer points	Bought from Death costing 150 reaper points.	3	Medium	Hard	Elite	Reaper Requirement
VVW3	Obtain the Mahjarrat aura	Unlocked in the Reaper store for 1,000 Reaper Points. It increases the damage you deal and divine location cap by 5% for one hour each day.	5	Elite	Master	Legendary	Reaper Requirement
2QD2	Unlock the Reaper scroll	Unlocked in the Reaper store for 250 Reaper Points. It permanently increases the Slayer XP received from reaper tasks by 50%.	3	Hard	Elite	Master	Reaper Requirement
E2G7	Unlock the instance cost reduction	Unlocked in the Reaper store for 250 Reaper Points. It permanently reduces the cost of boss instancing by 25%.	3	Hard	Elite	Master	Reaper Requirement
6QDQ	Unlock the Bonfire booster	Unlocked in the Reaper store for 250 Reaper Points or 2,500 Slayer Points. It permanently increases the duration of bonfire health boosts by 25%.	3	Hard	Elite	Master	Reaper Requirement
Q8W4	Unlock Death's Support	Unlocked in the Reaper store for 250 Reaper Points. It permanently doubles the amount healed from sign and portent of life and death.	3	Hard	Elite	Master	Reaper Requirement
D29Q	Unlock the Rainbow loot beam	Unlocked in the Reaper store for 75 Reaper Points or 750 Slayer Points.	3	Medium	Hard	Elite	Reaper Requirement
WVWZ	Unlock the Grave loot beam	Unlocked in the Reaper store for 75 Reaper Points or 750 Slayer Points.	3	Medium	Hard	Elite	Reaper Requirement
5QGR	Obtain the Death Scythe	Unlocked upon completion of 100 Reaper assignments.	4	-	Medium	Hard	Reaper Requirement
3QDE	Obtain Tiny Death	Unlocked upon completion of 200 Reaper assignments.	4	Medium	Hard	Elite	Reaper Requirement
B2M5	Obtain the Vanquisher's gauntlets	Requires a total of 250 bosses killed, with at least 5 kills on each boss.	5	Master	Legendary	God	Can't kill all bosses before Master tier
78DD	Obtain the Vanquisher's greaves	Requires a total of 500 bosses killed, with at least 10 kills on each boss.	5	Master	Legendary	God	Can't kill all bosses before Master tier
M42Y	Obtain the Vanquisher's cuisses	Requires a total of 1,000 bosses killed, with at least 20 kills on each boss.	5	Master	Legendary	God	Can't kill all bosses before Master tier
KZ83	Obtain the Vanquisher's cuirass	Requires a total of 1,500 bosses killed, with at least 30 kills on each boss.	5	Master	Legendary	God	Can't kill all bosses before Master tier
G7NE	Obtain the Vanquisher's skull	Requires a total of 2,500 bosses killed, with at least 50 kills on each boss.	5	Master	Legendary	God	Can't kill all bosses before Master tier
Z2W8	Unlock the War's Retreat teleport	Unlocked in War's Wares after having at least 10 boss kills.	1	-	-	Easy	Can't kill bosses until easy tier
98D3	Unlock the Boss portal at War's Retreat	Unlocked in War's Wares after having at least 100 boss kills.	2	-	-	Easy	Can't kill bosses until easy tier
4QDN	Unlock the Altar of War	Unlocked in War's Wares after having at least 200 boss kills.	2	-	Easy	Medium	Can't kill bosses until easy tier
8G85	Unlock the 'refresh ability cooldown' ability at the Altar of War	This unlock requires 500 boss kills.	2	-	Easy	Medium	Can't kill bosses until easy tier
XVW7	Unlock the Adrenaline crystals at War's Retreat	Unlocked in War's Wares after having at least 1,000 boss kills.	2	Easy	Medium	Hard	Can't kill bosses until easy tier
784R	Unlock the Adrenaline potion refresh at War's Retreat	Unlocked in War's Wares after having at least 2,000 boss kills.	3	Easy	Medium	Hard	Can't kill bosses until easy tier
KZ3X	Obtain the Vampyrism aura	Unlocked in War's Wares for 5,000 Marks of War.	3	-	Easy	Medium	Can't kill bosses until easy tier
B23N	Obtain the Dark magic aura	Unlocked in War's Wares for 12,500 Marks of War.	4	-	Easy	Medium	Can't kill bosses until easy tier
M43E	Obtain the Berserker aura	Unlocked in War's Wares for 25,000 Marks of War.	4	Easy	Medium	Hard	Can't kill bosses until easy tier
Z2QB	Obtain the Reckless aura	Unlocked in War's Wares for 25,000 Marks of War.	4	Easy	Medium	Hard	Can't kill bosses until easy tier
98NK	Obtain the Maniacal aura	Unlocked in War's Wares for 25,000 Marks of War.	4	Easy	Medium	Hard	Can't kill bosses until easy tier
4QM2	Die by the Blade!	Get killed by a Hanto sellsword in the Temple of Aminishi. Not safe for hardcores! Ensure you have an extra life.	3	-	Hard	Elite	Normal mode Sanctum Guardian requires Hard tier
EV2B	Receive thanks from Gorvek by becoming the MVP of a Croesus encounter	To become the MVP, you must be the top contributing player in the encounter.	3	Hard	Hard	Elite	Do well at Croesus once
NX3X	Get rescued by the Sign of Life effect 50 times!	Trigger a sign of life effect a total of 50 times. Activating a sign of death, portent of life, portent of death or the Defence cape perk also counts for this.	4	Medium	Hard	Elite	Passively obtained
NQQV	Obtain the Golden Soul cape	Completion of the Nomad's Elegy quest is required. Defeat the Memory of Nomad encounter in under 6 minutes.	5	-	-	Master	Unlock in Master task
7BKJ	Unlock the 'the Warden' title	Obtaining the title requires you to manage a Telos kill at 500% enrage.	5	Master	Master	Legendary	Boss experience
823M	Become the Silver Warden	Obtaining the title requires you to manage a Telos kill at 2,000% enrage.	5	Master	Legendary	God	Boss experience
223Y	Become the True Warden	Obtaining the title requires you to manage a Telos kill at 4,000% enrage.	5	Master	Legendary	God	Boss experience
4Y5J	Defeat Araxxi at 300% Enrage	Path 2/Path 3 would be highly recommended. Refer to the wiki to see what paths are open currently.	5	Elite	-	Master	Boss experience
JBKJ	Unlock the 'the Iceborn' title	Defeat the Arch-Glacor at 500% enrage. Good luck.	5	Hard	Elite	Master	Boss experience
M9K2	Become the silver Iceborn	Defeat Icy Telos (otherwise known as Arch-Glacor) at an enrage of 2,000% or higher. Good luck.	5	-	Master	Legendary	Boss experience
ZX7Q	Become the True Iceborn	Defeat Icy Telos (otherwise known as Arch-Glacor) at an enrage of 4,000% or higher. Good luck.	5	-	Legendary	God	Boss experience
79Q3	Unlock the Arch-Gladys skin for Gladys	The Arch-Gladys skin for Gladys is unlocked after defeating the Hardmode version of the Arch-Glacor 1,000 times.	5	-	Master	Legendary	High boss KC
X92R	Unlock the Time Clone skin for Kerry	The Time Clone skin for Kerry is unlocked after defeating the Hardmode version of Kerapac 1,000 times.	5	-	Master	Legendary	High boss KC
6ZQE	Unlock the reskinned-variant of the Little Sus pet	The purple skin variant is obtained by defeating Croesus 1,000 times.	4	-	Master	Legendary	High boss KC
X99G	Unlock the reskinned-variant of Little Zuk pet	The reskin can be obtained by defeating TzKal-Zuk 200 times in Hard Mode.	4	-	-	Legendary	High boss KC
Z9D6	Unlock the Raptor's Advanced outfit	The Raptors outfit can be obtained from looting the Raptors chest. Raptor key parts can be obtained from Archeron mammoths, Ripper demons, Living wyverns and Camel warriors.	4	Elite	-	Master	Assembly based on item drops in latest possible tier
2XW3	Unlock the ability to create hard mode Vorago instances	The hard mode option for Vorago is unlocked after a performing the finishing blow on Vorago with the Maul of Omens on all six of the weekly Vorago rotations (Ceiling collapse, Scopulus, Vitalis, Green bomb, TeamSplit, and The End). You can see which conditions you lack by reading the sign near the entrance to the borehole.	5	Elite	Master	Legendary	Timegated + boss locked to Elite+
DYB9	Defeat each of the Barrows brothers dealing the killing blow with their own weapon	Most weapons should be obtained by this point. If not good luck, and have fun!	4	Hard	Elite	Master	Linza + Akrisae unlock in Hard, weapon RNG until log completion in Master
8K7N	Unlock the 'Wrath of Chaos' title	This title is unlocked after defeating Zamorak, Lord of Chaos at solo 500% enrage	5	Elite	Master	Legendary	Boss experience
VX3N	Unlock the silver 'Wrath of Chaos' title	This title is unlocked after defeating Zamorak, Lord of Chaos at solo 2,000% enrage	5	Elite	Master	Legendary	Boss experience
2XZ3	Unlock the gold 'Wrath of Chaos' title	This title is unlocked after defeating Zamorak, Lord of Chaos at solo 4,000% enrage	5	Master	Legendary	God	Boss experience
EBJZ	Unlock the 'Lord of Chaos' title	This title is unlocked after defeating Zamorak, Lord of Chaos at 500% enrage in a group	5	Elite	Master	Legendary	Boss experience
6YM5	Unlock the silver 'Lord of Chaos' title	This title is unlocked after defeating Zamorak, Lord of Chaos at 2,000% enrage in a group	5	Elite	Master	Legendary	Boss experience
QBGD	Unlock the gold 'Lord of Chaos' title	This title is unlocked after defeating Zamorak, Lord of Chaos at 4,000% enrage in a group	5	Master	Legendary	God	Boss experience
JM3D	Obtain the full Globetrotter outfit	Unlocked in Zaida's Treasure Trails Reward shop for a total of 4,950 Treasure Trail points.	5	Elite	Elite	Master	Based on required Treasure Trail points
K7MV	Unlock the way of the foot-shaped key	Unlocked in Zaida's Treasure Trails Reward shop for 500 Treasure Trail points.	4	Elite	Elite	Master	Based on required Treasure Trail points
R83V	Obtain Blue the pupper	Unlocked in Zaida's Treasure Trails Reward shop for 2,500 Treasure Trail points.	5	Elite	Master	Legendary	Based on required Treasure Trail points
YVQ4	Unlock the 'the Explorer' title	Unlocked in Zaida's Treasure Trails Reward shop for 750 Treasure Trail points.	4	Elite	-	Master	Based on required Treasure Trail points
85XK	Unlock the 'Globetrotter' title	Unlocked in Zaida's Treasure Trails Reward shop for 750 Treasure Trail points.	4	Elite	-	Master	Based on required Treasure Trail points
VVQ8	Unlock the 'the Enigmatologist' title	Unlocked in Zaida's Treasure Trails Reward shop for 750 Treasure Trail points.	4	Elite	-	Master	Based on required Treasure Trail points
BDVV	Unlock the clue capacity upgrade	Unlocked in Zaida's Treasure Trails Reward shop for 750 Treasure Trail points.	4	Elite	-	Master	Based on required Treasure Trail points
2QK6	Obtain all General clue uniques	These are tracked in the general tab of your Treasure Trail Collection Log.	4	-	Elite	Master	Clue RNG
E23G	Construct and fill all Hidey-holes	A Construction level of 88 is required. Fill all 58 of the Treasure Trail hidey-holes. A complete list of hidey-holes can be found at the noticeboard by Zaida and in the Treasure Trail collection log.	4	-	Elite	Master	Drop RNG
6Q99	Dig up a Clue scroll using the Meerkat familiar's special move	A Summoning level of 4 is required. Use the Meerkat's special move called fetch casket. The pouches and scrolls can both be obtained as a general reward from any tier of Treasure Trail. The pouch can be turned into scrolls if so needed.	1	Beginner	-	Easy	Early Clue RNG
ZYXK	Create all illuminated god books	A Prayer and Crafting level of 60 are required as well as completion of the quest One Piercing Note. Use a filled Book of Balance on the book-making table in the Abbey of St. Elspeth Citharede.	3	Medium	-	Hard	Clue RNG
X9WJ	Don't skip a celtic knot	Solve a celtic knot puzzle while completing elite clue scrolls.	2	-	-	Hard	Based on first Elite task
N4WZ	Don't skip a lockbox puzzle	Solve a lockbox puzzle while completing master clue scrolls.	2	-	-	Elite	Based on first Master task
JBYW	Don't skip a puzzle box	Solve a puzzle box while completing hard or elite clue scrolls.	2	-	-	Medium	Based on first Hard task
RGWW	Don't skip a towers puzzle	Solve a towers puzzle while completing master clue scrolls.	2	-	-	Elite	Based on first Master task
DDV7	Unlock the 'Double Agent' title	This title requires you to log any cape slot item, any piece of Third-Age Equipment, one of either the Barrows or Shadow dyes and all other uniques (including all masks) in the hard tier of the Treasure Trail collection log.	5	Master	Legendary	God	Clue completion RNG
5WM2	Unlock the 'the Clue Chaser' title	This title requires you to log any cape slot item, any piece of Third-Age Druidic Equipment, any dye and all other uniques (including all masks and God Bows) in the elite tier of the Treasure Trail collection log.	5	Master	Legendary	God	Clue completion RNG
GDV7	Unlock the 'Master of Clues' title	This title requires you to log any cape slot item, any piece of Second-Age Equipment, every type of dye and all other uniques (including all masks and glasses) in the master tier of the Treasure Trail collection log.	5	-	-	God	Clue completion RNG
7V9V	Unlock the golden 'Master of Clues' title	This title requires you to log all capes, 1 piece of each Second-Age style (Melee, Magic, and Ranged), Orlando Smith's Hat and all other uniques (including all masks and glasses) in the master tier of the Treasure Trail collection log. Good luck!	5	-	-	God	Clue completion RNG
WD3R	Obtain Artemis, the clue scroll pet	You have a chance of obtaining a golden compass while completing clue steps or opening caskets. Interacting with it unlocks the pet.	5	Beginner	Legendary	God	Clue RNG
KMNB	Complete a grand total of 1,000 clue scrolls	An unlock in the Easy tier allows you to complete clue scrolls at will.	3	Hard	-	Elite	Based on placement of clue tasks
78NR	Read all the Murals in the Sunken Pyramid	A Slayer level of 99 is required. A minimum of 110 souls must be captured and registered in your Slayerdex.	5	-	-	Master	Based on amount of souls required
